{
  "schema": "capability-v1",
  "id": "primer.calculate_tm",
  "version": "0.0.0",
  "role": "ACTION",
  "summary": "Calculate DNA_NN3 nearest-neighbor Tm and emit every concentration parameter.",
  "effects": [
    "pure"
  ],
  "deterministic": true,
  "requires_runtime": [
    {
      "kind": "python_package",
      "name": "biopython",
      "probe": null
    }
  ],
  "inputs": [
    {
      "name": "primer",
      "type": "material",
      "required": true,
      "constraints": {},
      "description": "primer"
    }
  ],
  "params": {
    "type": "object",
    "properties": {
      "sodium_mM": {
        "type": "string",
        "pattern": "^(?:0|[1-9][0-9]*)(?:\\.[0-9]+)?$"
      },
      "magnesium_mM": {
        "type": "string",
        "pattern": "^(?:0|[1-9][0-9]*)(?:\\.[0-9]+)?$"
      },
      "dntp_mM": {
        "type": "string",
        "pattern": "^(?:0|[1-9][0-9]*)(?:\\.[0-9]+)?$"
      },
      "total_oligo_nM": {
        "type": "string",
        "pattern": "^(?:0|[1-9][0-9]*)(?:\\.[0-9]+)?$"
      }
    },
    "required": [],
    "additionalProperties": false
  },
  "outputs": [
    {
      "name": "report",
      "type": "document",
      "output_role": "analysis",
      "schema_ref": "urn:grt:schema:goal-v1#/$defs/value"
    }
  ],
  "step_checks": [],
  "final_checks": [],
  "does_not_establish": [
    "Wet-laboratory success, biological function or reaction efficiency.",
    "Genome-wide safety or thermodynamic structure quality unless explicitly measured."
  ],
  "source": {
    "algorithm_refs": [
      "spec/MIGRATION-MAP.md: batches 1-4",
      "MIGRATION-LOG.md"
    ],
    "implemented_in": "dna_design_core.capabilities.builtin.primer.operations:melting_temperature"
  },
  "owner": "core",
  "granularity": "atomic"
}
