{
  "schema": "capability-v1",
  "id": "check.lineage",
  "version": "0.0.0",
  "role": "CHECK",
  "summary": "Match explicit input bindings to the recorded content identities.",
  "effects": [
    "reads_files"
  ],
  "deterministic": true,
  "requires_runtime": [],
  "inputs": [],
  "params": {
    "type": "object",
    "properties": {},
    "additionalProperties": false
  },
  "outputs": [],
  "step_checks": [],
  "final_checks": [],
  "does_not_establish": [
    "Wet-laboratory performance or biological function."
  ],
  "source": {
    "algorithm_refs": [],
    "implemented_in": "dna_design_core.capabilities.builtin.checks:lineage"
  },
  "owner": "core",
  "granularity": "atomic",
  "scope": "content_model",
  "evaluates_constraint": false,
  "offline": true,
  "fixtures": {
    "pass": "tests/fixtures/checks/check.lineage.pass.json",
    "fail": "tests/fixtures/checks/check.lineage.fail.json"
  }
}
