{
  "schema": "capability-v1",
  "id": "cut_plasmid.model_replace",
  "version": "0.0.0",
  "role": "ACTION",
  "summary": "Draft contract for cut_plasmid.model_replace; no Kit implementation exists.",
  "effects": [
    "pure"
  ],
  "deterministic": true,
  "requires_runtime": [],
  "inputs": [
    {
      "name": "vector",
      "type": "material",
      "required": true,
      "constraints": {},
      "description": "vector"
    },
    {
      "name": "target",
      "type": "material",
      "required": true,
      "constraints": {},
      "description": "target"
    }
  ],
  "params": {
    "type": "object",
    "properties": {
      "promoter_end": {
        "type": "integer",
        "minimum": 0
      },
      "transcription_strand": {
        "enum": [
          -1,
          1
        ]
      },
      "scaffold_sequence": {
        "type": "string"
      },
      "spacer": {
        "type": "string",
        "pattern": "^[ACGT]{20}$"
      }
    },
    "required": [
      "promoter_end",
      "transcription_strand",
      "scaffold_sequence",
      "spacer"
    ],
    "additionalProperties": false
  },
  "outputs": [
    {
      "name": "product",
      "type": "material",
      "output_role": "construct"
    }
  ],
  "step_checks": [],
  "final_checks": [],
  "does_not_establish": [
    "Cleavage activity",
    "Editing efficiency",
    "Genome-wide off-target safety",
    "Wet-laboratory PCR, DpnI, KLD or transformation."
  ],
  "source": {
    "algorithm_refs": [
      "spec/MIGRATION-MAP.md section 6"
    ],
    "implemented_in": "grt_kit_cut_plasmid.capabilities.operations:model_replace"
  },
  "owner": "kit:cut-plasmid",
  "granularity": "atomic"
}
